#CODE;ENGLISH;;;;;;;;;;;;;x
secretly_convert_to_terran_imperial_holy_site;;;;;;;;;;;;;x
secretly_convert_to_terran_imperial_holy_site_desc;The writings of Terran Imperialists emerging from this historic site in §Y[Root.Location.GetName]§! impress me with the depth and passion of their ideology. I am tempted to convert in secrecy...;;;;;;;;;;;;;x
secretly_convert_to_neo_socialist_holy_site;Secretly adopt Neo Socialism;;;;;;;;;;;;;x
secretly_convert_to_neo_socialist_holy_site_desc;The writings of Neo Socialists emerging from this historic site in [Root.Location.GetName] impress me with the depth and passion of their ideology. I am tempted to convert in secrecy...;;;;;;;;;;;;;x
secret_religions_personally_adopt_secret_religion;Personally Adopt Ideology;;;;;;;;;;;;;x
secret_religions_personally_adopt_secret_religion_desc;Give up the charade of your the false beliefs you've acted upon and openly declare your true ideology.;;;;;;;;;;;;;x
secret_religions_renounce_secret_religion;Renounce Secret Ideology;;;;;;;;;;;;;x
secret_religions_renounce_secret_religion_desc;You quit the practices of your secret ideology and concede that its beliefs were flawed.;;;;;;;;;;;;;x
