#CODE;ENGLISH;FRENCH;GERMAN;;SPANISH;;;;;;;;;x
onideguzu_specimen_desc;The onideguzu is an omnivorous creeping vine-like species native to the planet Hiyokuna Oka. An onideguzu plant consists of a central tuber covered in hair-like fibers, which grow out from the plant to become its roots and creeping vine tendrils, which themselves grow their own layers of fiber. Within the fibers lie a rudimentary nervous system, which enables surprisingly rapid movement. They reproduce by growing dull and colorless flowers, advertising these flowers to pollinating insectoids by the release of pigment in the surrounding vines.;;;;;;;;;;;;;x
omidi_giant_mangrove_specimen;Omidi Giant Mangrove;;;;;;;;;;;;;x
omidi_giant_mangrove_specimen_desc;Native to Omid III, the giant mangrove is a dendroid species that can grow to immense sizes. It consists of a central trunk that resembles a wooden braid, from which grows an elaborate network of branches supported by adventitious stilt roots that hold the tree above the water level during Omid III's rainy season. A single giant mangrove's root network can cover an entire square kilometer. This one is considerably smaller.;;;;;;;;;;;;;x
steelwood_specimen;Steelwood Tree;;;;;;;;;;;;;x
steelwood_specimen_desc;The steelwood is a dendroid species native to the tropics of Nae Bangladesa II. While superficially resembling a Terran tree, they are especially notable for the extreme strength and hardness of their wood, which has evolved to resist Nae Bangladesa II's frequent tropical storms.;;;;;;;;;;;;;x
chengdu_coral_specimen;Chengdu Coral Colony;;;;;;;;;;;;;x
chengdu_coral_specimen_desc;An aerobic polyp species native to Chengdu Prime, Chengdu coral resembles Terran corals, but is capable of surviving on land. It naturally forms elaborate and colorful reefs that dominate Chengdu Prime's lowlands. Growing it in higher gravity environments is difficult, but with careful cultivation practices it can grow into elaborate and beautiful patterns.;;;;;;;;;;;;;x
razorgrass_specimen;Razorgrass Specimen;;;;;;;;;;;;;x
razorgrass_specimen_desc;Native to Pu-Erh, razorgrass is a violet grass-like species known for two properties. The first is its role in the production of Pu-Erh tea, which is widely considered some of the finest in the known worlds. The second is the silica phytolith formed on its blades, which is sharp enough to sever a human limb.;;;;;;;;;;;;;x
metagenic_wasp_specimen;Mti wa Nyongo Tree;;;;;;;;;;;;;x
metagenic_wasp_specimen_desc;Native to Kimbilio II, the mti wa nyongo is a flowering dendroid notorious for its unique life cycle - its "flowers" are in fact eggs that hatch into small, flying insectoids, known as metagenic wasps. The wasps possess a rudimentary intelligence that allows them to seek out ideal growing locations, where they entomb themselves in the soil. The wasp's body forms a natural shell around the tree's seed, protecting it from the elements.;;;;;;;;;;;;;x
world_tree_specimen;World Tree Clipping;;;;;;;;;;;;;x
world_tree_specimen_desc;The World Tree of Takagi III is sometimes mistaken for an immense forest of redwood-like dendroids, but it is in fact a single clonal organism that covers almost the entirety of the planet's sole continent, held off only by deserts and the ocean, having essentially choked out all other Takagi flora. The World Tree has been slowly receding ever since the arrival of the first human settlers.;;;;;;;;;;;;;x
rainbow_grass_specimen;Herba da Vella Specimen;;;;;;;;;;;;;x
rainbow_grass_specimen_desc;A grass-like species native to Nueva Galicia, herba da vella is named for an evolutionary response to Nueva Galicia's three suns - depending on local light conditions, which may vary dramatically depending on latitude, epigenetic triggers can cause it to deploy alternative pigments to chlorophyll - depending on which sun is most prominent at its latitude, herba da vella may appear green, red, or blue, in order to efficiently absorb the most light. In captivity, herba da vella is grown under special lighting conditions to favor particular colors.;;;;;;;;;;;;;x
touchdown_tumbleweed_specimen;Touchdown Tumbleweed;;;;;;;;;;;;;x
touchdown_tumbleweed_specimen_desc;Native to the semi-arid steppes of Touchdown II, the Touchdown tumbleweed is notable as a plant-like species that releases a living, rather than dead, tumbleweed. As the plant's roots absorb nutrients, they loosen the soil, until it becomes loose enough that the entire plant can be picked up and blown by Touchdown II's combination of strong winds and low gravity. As the tumbleweed rolls, it releases spores, before finally coming to rest in soil that resists its roots and setting them down again.;;;;;;;;;;;;;x
chengdu_coral_sculpture;Chengdu Coral Sculpture;;;;;;;;;;;;;x
chengdu_coral_sculpture_desc;A small decorative sculpture made of dead Chengdu coral, carefully grown so as to form the correct shape.;;;;;;;;;;;;;x
start_research_project_self_decision;Start a New Research Project;;;;;;;;;;;;;x
start_research_project_self_decision_desc;Despite considering yourself a scientist and an intellectual, you're currently not involved in any ongoing research projects. Now might be a good time to get started on one.;;;;;;;;;;;;;x
start_research_project_liege_decision;Petition [Root.Liege.GetCrisisBestName] for a Research Grant;;;;;;;;;;;;;x
military_research_project;Military Research Project;;;;;;;;;;;;;x
military_research_project_desc;This character is researching new advances in military engineering.;;;;;;;;;;;;;x
social_research_project;Social Research Project;;;;;;;;;;;;;x
social_research_project_desc;This character is researching new advances in social science.;;;;;;;;;;;;;x
physical_research_project;Physical Research Project;;;;;;;;;;;;;x
physical_research_project_desc;This character is researching new advances in natural science.;;;;;;;;;;;;;x
opinion_approved_grant;Approved Research Grant;;;;;;;;;;;;;x
opinion_refused_grant;Refused Research Grant;;;;;;;;;;;;;x
opinion_assisted_my_research;Assisted My Research;;;;;;;;;;;;;x
opinion_ruined_my_research;Ruined My Research;;;;;;;;;;;;;x
opinion_accepted_my_assistance;Accepted My Assistance;;;;;;;;;;;;;x
opinion_refused_my_assistance;Refused My Assistance;;;;;;;;;;;;;x
opinion_produced_results;Produced Results;;;;;;;;;;;;;x
EVTTOOLTIPLIFESTYLE10911;You will need to select a field to research.;;;;;;;;;;;;;x
EVTDESCLIFESTYLE10911;You're considering starting a new research project. The first thing to decide, of course, is what field you'll be researching - the physical sciences, the social sciences, or military engineering?;;;;;;;;;;;;;x
EVTOPTALIFESTYLE10911;Start a military research project.;;;;;;;;;;;;;x
EVTOPTBLIFESTYLE10911;Start a social research project.;;;;;;;;;;;;;x
EVTOPTCLIFESTYLE10911;Start a physical research project.;;;;;;;;;;;;;x
EVTDESCLIFESTYLE11011;You're considering petitioning [Root.Liege.GetCrisisBestName] for a research grant. Obviously, the first and most important factor to consider is what field of research you'll be working in - the physical sciences, the social sciences, or military engineering. Since the [Root.Liege.PrimaryTitle.GetFullName] will receive most of the benefits of your research, you should choose the field you think [Root.Liege.GetCrisisBestName] would be most likely to fund.;;;;;;;;;;;;;x
EVTDESCLIFESTYLE11111;TO: [Root.GetCrisisFormalName]\nFROM: [From.GetCrisisFormalName]\nRE: Research grant\nI am currently investigating research that could potentially lead to major developments in the field of military engineering, which could greatly benefit the [Root.PrimaryTitle.GetFullName] in wartime. I'd like to request a grant to pursue this line of inquiry further.;;;;;;;;;;;;;x
EVTDESCLIFESTYLE11211;TO: [Root.GetCrisisFormalName]\nFROM: [From.GetCrisisFormalName]\nRE: Research grant\nYour request is approved. I have assigned you an appropriately sized grant with which to pursue your research. I expect to see results.;;;;;;;;;;;;;x
EVTDESCLIFESTYLE11311;TO: [Root.GetCrisisFormalName]\nFROM: [From.GetCrisisFormalName]\nRE: Research grant\nYour request is denied. The [From.PrimaryTitle.GetFullName] cannot afford to fund your research at this time.;;;;;;;;;;;;;x
EVTDESCLIFESTYLE11411;TO: [Root.GetCrisisFormalName]\nFROM: [From.GetCrisisFormalName]\nRE: Research grant\nI am currently investigating research that could potentially lead to major developments in the field of social science, which could greatly benefit the [Root.PrimaryTitle.GetFullName] both politically and economically. I'd like to request a grant to pursue this line of inquiry further.;;;;;;;;;;;;;x
EVTDESCLIFESTYLE11611;TO: [Root.GetCrisisFormalName]\nFROM: [From.GetCrisisFormalName]\nRE: Research grant\nI am currently investigating research that could potentially lead to major developments in the field of natural science, which could greatly benefit the [Root.PrimaryTitle.GetFullName] technologically. I'd like to request a grant to pursue this line of inquiry further.;;;;;;;;;;;;;x
EVTDESCLIFESTYLE10011;With the loss of your demesne, you are no longer eligible to have techpoints, and therefore can't continue your research project. Also, how are you reading this? You're not a landed ruler, you should have gotten a game over.;;;;;;;;;;;;;x
EVTOPTALIFESTYLE10011;Please file a bug report.;;;;;;;;;;;;;x
EVTDESCLIFESTYLE10111;With your newfound political independence comes academic independence. Your current ongoing research project will now be put to use for the good of the [Root.PrimaryTitle.GetFullName].;;;;;;;;;;;;;x
EVTDESCLIFESTYLE10211;[From.GetCrisisBestName] has made progress on [From.GetHerHis] research project. Current Progress: [From.research_progress]/[From.research_difficulty].;;;;;;;;;;;;;x
EVTDESCLIFESTYLE10311;You have made progress on your research project. Current Progress: [Root.research_progress]/[Root.research_difficulty].;;;;;;;;;;;;;x
EVTDESCLIFESTYLE10411;At last, after years of effort, your research project is finally complete. You've successfully [Root.GetRandomResearchResult], which should greatly benefit the [Root.PrimaryTitle.GetFullName] in the years to come.;;;;;;;;;;;;;x
String_designed_a_new_missile_guidance_system;designed a revolutionary new missile guidance system;;;;;;;;;;;;;x
String_developed_a_new_super_strong_alloy;developed an extremely resilient new alloy;;;;;;;;;;;;;x
String_designed_a_revolutionary_new_propulsion_system;designed a revolutionary new propulsion system;;;;;;;;;;;;;x
String_developed_an_extremely_powerful_energy_weapon;developed an extremely powerful new energy weapon;;;;;;;;;;;;;x
String_made_a_revolutionary_breakthrough_in_economic_theory;made a revolutionary new breakthrough in economic theory;;;;;;;;;;;;;x
String_made_a_revolutionary_breakthrough_in_human_psychology;made a revolutionary new breakthrough in human psychology;;;;;;;;;;;;;x
String_made_a_revolutionary_breakthrough_in_social_psychology;made a revolutionary new breakthrough in social psychology;;;;;;;;;;;;;x
String_developed_a_new_medicine;developed a new medicine for a disease previously considered untreatable;;;;;;;;;;;;;x
String_made_a_revolutionary_breakthrough_in_neuroscience;made a revolutionary breakthrough in neuroscience;;;;;;;;;;;;;x
String_taxonomized_an_entire_planet;taxonomized the native lifeforms of an entire alien planet;;;;;;;;;;;;;x
String_developed_a_revolutionary_new_processing_chip;developed a revolutionary new processing chip;;;;;;;;;;;;;x
EVTOPTALIFESTYLE10411;A job well done.;;;;;;;;;;;;;x
EVTDESCLIFESTYLE10511;At last, after years of effort, your research project is finally complete. You've successfully [Root.GetRandomResearchResult], which should greatly benefit the [Root.Liege.PrimaryTitle.GetFullName] in the years to come. [Root.Liege.GetCrisisBestName] will be pleased.;;;;;;;;;;;;;x
EVTDESCLIFESTYLE10611;At last, after years of effort, [From.GetCrisisBestName] has successfully completed the research project you funded. [From.GetSheHeCap] has [From.GetRandomResearchResult], which should greatly benefit the [Root.PrimaryTitle.GetFullName] in the years to come.;;;;;;;;;;;;;x
EVTOPTALIFESTYLE10611;Money well spent.;;;;;;;;;;;;;x
EVTDESCLIFESTYLE1011;Unfortunately, this year has not done well for your research. You've found yourself following false leads and trapped in dead ends. Entire months of work produced no useful results. Progress has slowed.;;;;;;;;;;;;;x
EVTOPTALIFESTYLE1011;Be satisfied with your current pace.;;;;;;;;;;;;;x
EVTOPTBLIFESTYLE1011;Assemble a larger team to investigate more avenues of research.;;;;;;;;;;;;;x
EVTOPTCLIFESTYLE1011;Put in extra hours of research.;;;;;;;;;;;;;x
EVTOPTDLIFESTYLE1011;Assemble a larger team and put in extra work yourself.;;;;;;;;;;;;;x
EVTDESCLIFESTYLE1111;Despite your best efforts, you've failed to make any additional headway on your research.;;;;;;;;;;;;;x
EVTOPTALIFESTYLE1111;I'm sure this problem will yield soon enough.;;;;;;;;;;;;;x
EVTDESCLIFESTYLE1211;The work you've been putting into your research has paid off - you've managed to get several results, making twice the progress you expected to a mere matter of weeks ago.;;;;;;;;;;;;;x
EVTOPTALIFESTYLE1211;Let's try to keep up this pace.;;;;;;;;;;;;;x
EVTDESCLIFESTYLE1311;Success! Your most recent research breakthroughs have led to astonishing results. You've made an immense amount of progress on your research project.;;;;;;;;;;;;;x
EVTOPTALIFESTYLE1311;Eureka!;;;;;;;;;;;;;x
EVTDESCLIFESTYLE1411;Progress on your research project has been steady this year. While you haven't found any truly astonishing results, you also haven't wasted any time. The project remains on track.;;;;;;;;;;;;;x
EVTDESCLIFESTYLE1811;Eureka! You've made an enormous breakthrough in your research project. It will take a large team and plenty of effort to follow up all of the avenues of research this breakthrough has opened up, but even the discovery itself has advanced your project significantly.;;;;;;;;;;;;;x
EVTDESCLIFESTYLE2211;[assistance_target.GetCrisisBestName] is currently working on a [assistance_target.GetProjectType] research project[assistance_target.GetRootFieldKnowledge]. You might be able to help [assistance_target.GetHerHis] research along by collaborating with [assistance_target.GetHerHim].;;;;;;;;;;;;;x
String_military_engineering;military engineering;;;;;;;;;;;;;x
String_social_science;social science;;;;;;;;;;;;;x
String_natural_science;natural science;;;;;;;;;;;;;x
String_field_knowledge_good;, a field you're intimately familiar with;;;;;;;;;;;;;x
String_field_knowledge_bad;. While this isn't necessarily your field, you're still a fellow [Root.GetManWoman] of science;;;;;;;;;;;;;x
EVTOPTALIFESTYLE2211;I should lend [assistance_target.GetHerHim] a hand.;;;;;;;;;;;;;x
EVTOPTBLIFESTYLE2211;I think I'll leave [assistance_target.GetHerHim] to [assistance_target.GetHerselfHimself].;;;;;;;;;;;;;x
EVTDESCLIFESTYLE2311;[From.GetCrisisBestName] has offered [From.GetHerHis] assistance with your ongoing research project. Given [From.GetHerHis] keen interest in intellectual matters, you have no reason to refuse. [From.GetHerHisCap] expertise should speed the project along.;;;;;;;;;;;;;x
EVTOPTALIFESTYLE2311;Always good to have an extra set of eyes.;;;;;;;;;;;;;x
EVTDESCLIFESTYLE2411;[assistance_target.GetCrisisBestName] is currently working on a [assistance_target.GetProjectType] research project. [assistance_target.GetHerHisCap] methods are strictly conventional, as is [assistance_target.GetHerHis] field of study. Perhaps you could help [assistance_target.GetHerHim] think outside the box.;;;;;;;;;;;;;x
EVTTOOLTIPLIFESTYLE2511;will consider your offer.;;;;;;;;;;;;;x
EVTDESCLIFESTYLE2511;[From.GetCrisisBestName] has offered [From.GetHerHis] assistance with your ongoing research project. Apparently, [From.GetSheHe] thinks that [From.GetUnsolvableProblem] is somehow relevant to [Root.GetProjectType]. Of course [From.GetSheHe] does.;;;;;;;;;;;;;x
EVTOPTALIFESTYLE2511;Give [From.GetHerHim] access to sensitive research data.;;;;;;;;;;;;;x
EVTOPTBLIFESTYLE2511;Keep [From.GetHerHim] far, far away.;;;;;;;;;;;;;x
EVTDESCLIFESTYLE2611;To your considerable surprise, [FromFrom.GetCrisisBestName] actually turns out to have the slightest clue what [FromFrom.GetSheHe]'s doing. More than a slight clue, in fact, [FromFrom.GetSheHe] manages to show you the problem you were working on from an entirely new angle. Suddenly, a problem that was once intractable seems almost trivial. The amount of progress you've made is immense.;;;;;;;;;;;;;x
EVTOPTALIFESTYLE2611;I... I guess that worked?;;;;;;;;;;;;;x
EVTDESCLIFESTYLE2711;Hesitantly, [From.GetCrisisBestName] accepts your offer. You then proceed to demonstrate how problems [From.GetSheHe] thought unsolvable are actually mere special cases of a problem you solved in your own work on [Root.GetUnsolvableProblem]. [From.GetSheHeCap] seems almost surprised at how your theories turn [From.GetHerHis] efforts completely on their head.;;;;;;;;;;;;;x
EVTOPTALIFESTYLE2711;You just have to keep an open mind about these things.;;;;;;;;;;;;;x
EVTDESCLIFESTYLE2811;You've made a huge mistake. [FromFrom.GetSheHeCap] wastes your time babbling about nonsense, breaks your laboratory equipment, and accidentally deletes several years of research data. You're genuinely shocked [From.GetSheHe] didn't set anything on fire.;;;;;;;;;;;;;x
EVTOPTALIFESTYLE2811;Get out! Just GET OUT!;;;;;;;;;;;;;x
EVTDESCLIFESTYLE2911;Hesistantly, [From.GetCrisisBestName] accepts your offer. Unfortunately, the situation is even worse than you thought. [From.GetSheHeCap] has gotten [From.GetHerHis] mind stuck deep in a rut, wasting years of progress on a dead-end research path. You helpfully remove that useless data from [From.GetHerHis] files. Unfortunately, [From.GetSheHe] doesn't appear to appreciate your contribution.;;;;;;;;;;;;;x
EVTOPTALIFESTYLE2911;Genius is never understood in its own time.;;;;;;;;;;;;;x
EVTDESCLIFESTYLE3011;You receive a one-word reply from [From.GetCrisisBestName]: "No." You later learn that [From.GetSheHe] has blocked you on every platform [From.GetSheHe] could find, including several [From.GetSheHe] doesn't actually use. [From.GetSheHeCap] is rumored to be considering a restraining order. You are beginning to suspect that [From.GetSheHe] doesn't want your help.;;;;;;;;;;;;;x
go_hunting_decision;Go Hunting;;;;;;;;;;;;;x
go_hunting_decision_desc;A hunting trip to [Root.GetName] could be a worthwhile investment of your time. You will have to take a leave of absence for a few weeks.;;;;;;;;;;;;;x
EVTNAMELIFESTYLE1013;Hunting on [hunting_destination.GetName];;;;;;;;;;;;;x
EVTDESCLIFESTYLE1013;Before you depart on your hunting trip to [hunting_destination.GetName], you'll need to prepare - research the local wildlife, identify the ideal hunting sites, and make sure your equipment is ready. You'll also have to make some decisions about your technique - just what kind of hunting are you out here to do, anyway? What will your main weapon be?;;;;;;;;;;;;;x
EVTOPTALIFESTYLE1013;A [GetHuntingWeaponName].;;;;;;;;;;;;;x
String_hunting_rifle;hunting rifle;;;;;;;;;;;;;x
String_hunting_weapon;[hunting_weapon.GetName];;;;;;;;;;;;;x
EVTOPTBLIFESTYLE1013;I'll be bringing [hunting_raptor.GetName] along.;;;;;;;;;;;;;x
EVTOPTCLIFESTYLE1013;On second thought, perhaps I should do something else.;;;;;;;;;;;;;x
EVTTOOLTIPLIFESTYLE11013;will join you.;;;;;;;;;;;;;x
EVTDESCLIFESTYLE11013;After much consideration, [From.GetCrisisBestName] has decided on the destination for your hunting trip - [hunting_destination.GetName][hunting_destination.GetLifestyle11013DescA].[From.GetLifestyle11013DescB];;;;;;;;;;;;;x
String_lifestyle_11013_bai_gui;, homeworld of the elusive bai gui;;;;;;;;;;;;;x
String_lifestyle_11013_chouten_oni;, homeworld of the fearsome chouten-oni;;;;;;;;;;;;;x
String_lifestyle_11013_ghuul;, homeworld of the ghuul;;;;;;;;;;;;;x
String_lifestyle_11013_koloss;, homeworld of the mighty koloss;;;;;;;;;;;;;x
String_lifestyle_11013_lei_niao;, homeworld of the lei niao;;;;;;;;;;;;;x
String_lifestyle_11013_leviathan;, homeworld of the immense leviathan;;;;;;;;;;;;;x
String_lifestyle_11013_mimic;, homeworld of the mimic;;;;;;;;;;;;;x
String_lifestyle_11013_monoceros;, homeworld of the graceful monoceros;;;;;;;;;;;;;x
String_lifestyle_11013_paraisan_wolf;, homeworld of the Paraisan wolf;;;;;;;;;;;;;x
String_lifestyle_11013_ratatosuku;, homeworld of the nimble ratatosuku;;;;;;;;;;;;;x
String_lifestyle_11013_tunnel_cat;, homeworld of the tunnel cat;;;;;;;;;;;;;x
String_lifestyle_11013_hunting_rifle; You'll need a weapon. [From.GetSheHeCap] has agreed to provide you with a simple hunting rifle.;;;;;;;;;;;;;x
String_lifestyle_11013_hunting_weapon_2; You'll need a weapon. [From.GetSheHeCap] says that your [hunting_weapon_2.GetName] will do fine.;;;;;;;;;;;;x
String_lifestyle_11013_hunting_raptor_2; It's a falconry expedition, so you'll need to bring [hunting_raptor_2.GetName] along.;;;;;;;;;;;;;x
EVTTOOLTIPLIFESTYLE1113;will have to give you a hunting permit.;;;;;;;;;;;;;x
EVTDESCLIFESTYLE1113;The [hunting_destination.GetAdjective] Ministry of the Environment has forwarded you an application for a yearly hunting permit, signed by [From.GetCrisisFormalName][From.GetAndHuntingPartner]. Ordinarily, such matters are beneath your concern, but since this case has potential political ramifications, the Ministry has asked for your guidance.;;;;;;;;;;;;;x
String_and_hunting_partner; and [hunting_partner.GetCrisisFormalName];;;;;;;;;;;;;x
String_and_hunting_partner_informal; and [hunting_partner.GetCrisisInformalName];;;;;;;;;;;;;x
EVTOPTALIFESTYLE1113;Approve the hunting permit.;;;;;;;;;;;;;x
EVTOPTBLIFESTYLE1113;Approve the permit, and ask to join the expedition yourself.;;;;;;;;;;;;;x
EVTOPTCLIFESTYLE1113;Deny the hunting permit.;;;;;;;;;;;;;x
EVTDESCLIFESTYLE11113;Unfortunately, it looks like your hunting expedition may be over before it has even begun. The [hunting_destination.GetAdjective] Ministry of the Environment has denied your application for a hunting permit. The order comes signed by the planetary governor, [From.GetCrisisFormalName], [From.GetHerselfHimself].;;;;;;;;;;;;;x
EVTOPTALIFESTYLE11113;And I was looking forward to it, too.;;;;;;;;;;;;;x
EVTOPTBLIFESTYLE11113;I'm not going to let a little thing like the law stop me.;;;;;;;;;;;;;x
EVTTOOLTIPLIFESTYLE21113;will consider abandoning the hunt.;;;;;;;;;;;;;x
EVTDESCLIFESTYLE21113;Things aren't off to a good start. Your hunting permit was denied, in an order signed by the planetary governor [FromFrom.GetHerselfHimself]. [From.GetCrisisBestName] doesn't seem to care - [From.GetSheHe] is intent on going through with the hunting expedition anyway. If you join [From.GetHerHim], you'll be flouting [hunting_destination.GetAdjective] law.;;;;;;;;;;;;;x
EVTOPTALIFESTYLE21113;Poaching's a victimless crime anyway.;;;;;;;;;;;;;x
EVTOPTBLIFESTYLE21113;I think it's time I took my leave.;;;;;;;;;;;;;x
EVTDESCLIFESTYLE31113;Unfortunately, [From.GetCrisisBestName] doesn't share your lackadaisical attitude toward [hunting_destination.GetAdjective] law. [From.GetSheHeCap] steadfastly refuses to join you on your illegal hunting expedition. If you do this, you'll be doing it alone.;;;;;;;;;;;x
EVTOPTALIFESTYLE31113;I don't need [From.GetHerHis] help.;;;;;;;;;;;;;x
EVTOPTBLIFESTYLE31113;On second thought, maybe this isn't such a good idea.;;;;;;;;;;;;;x
EVTDESCLIFESTYLE41113;Your request for a [hunting_destination.GetAdjective] hunting permit has been approved by the Ministry of the Environment. What's more, the planetary governor, [From.GetCrisisFormalName], has officially requested to join you on your expedition. This could be a good chance to build political ties.;;;;;;;;;;;;;x
EVTOPTALIFESTYLE41113;The more the merrier.;;;;;;;;;;;;;x
EVTOPTBLIFESTYLE41113;I don't need any help.;;;;;;;;;;;;;x
EVTDESCLIFESTYLE51113;[From.GetCrisisBestName] has agreed to take you along on [From.GetHerHis] hunting expedition.[From.GetLifestyle11013DescB];;;;;;;;;;;;;x
EVTDESCLIFESTYLE61113;[From.GetCrisisBestName] is happy to accept the hunting permit, but has decided not to bring you along on the expedition.;;;;;;;;;;;;x
EVTOPTALIFESTYLE61113;[From.GetHerHisCap] loss.;;;;;;;;;;;;;x
EVTTOOLTIPLIFESTYLE1213;You will select game to hunt.;;;;;;;;;;;;;x
EVTDESCLIFESTYLE1213;After days of carefully checking and preparing your equipment, you're ready to begin the hunt. The first step is deciding precisely what kind of game to pursue. [hunting_destination.GetWildlifeDesc];;;;;;;;;;;;;x
String_wildlife_desc_nothing;[This.GetName] isn't home to any particularly unusual wildlife, so your choices are mostly a matter of whether you want to hunt safe, small game; potentially dangerous larger game; or go straight after predators.;;;;;;;;;;;;;x
String_wildlife_desc_bai_gui;[This.GetName] is the homeworld of the bai gui, a species of white-furred, bipedal pack predators native to the southern tundras. These elusive creatures might make for interesting prey.;;;;;;;;;;;;;x
String_wildlife_desc_chouten_oni;[This.GetName] is the homeworld of the chouten-oni - six-limbed, cold-blooded carnivores with thick, leathery skin and a single prominent horn. The chouten-oni are the most fearsome predators in the known worlds - there's considerable fame to be earned from taking their horns as trophies.;;;;;;;;;;;;;x
String_wildlife_desc_ghuul;The dark side of [This.GetName] is home to ghuuls: warm-blooded, four-limbed scavengers with thick, leathery skin, notable for their ability to mimic the cries of many of the dark side's common predators.;;;;;;;;;;;;;x
String_wildlife_desc_koloss;[This.GetName] is the homeworld of the notorious kolossy - the largest land-dwelling animals in known space. These herd-dwelling feathered herbivores can weigh over two hundred tonnes, and are fiercely territorial. You'll need to rent a flitter to hunt them.;;;;;;;;;;;;;x
