#CODE;ENGLISH;FRENCH;GERMAN;;SPANISH;;;;;;;;;x
EVTDESCLIFESTYLE10;You've always had an interest in botany - from the humble flowers of Earth to the most exotic of alien flora, from the oak tree to the [GetRandomPlantName]. You're considering starting a garden, with a focus on exotic alien plants.;;;;;;;;;;;;;x
EVTOPTALIFESTYLE10;I couldn't imagine a finer goal.;;;;;;;;;;;;;x
EVTOPTBLIFESTYLE10;Plants aren't for me.;;;;;;;;;;;;;x
EVTDESCLIFESTYLE11;You've always had an interest in both the natural world and the unnatural one. You find your curiosity constantly piqued. The universe is vast and full of wonders. You want to know more. You NEED to know more.;;;;;;;;;;;;;x
EVTOPTALIFESTYLE11;I will dedicate my life to the pursuit of knowledge.;;;;;;;;;;;;;x
EVTOPTBLIFESTYLE11;There are more important things.;;;;;;;;;;;;;x
EVTDESCLIFESTYLE12;Lately, you've been getting into sports [Root.GetAthleticsMotive]. You're considering trying out for the local amateur football team.;;;;;;;;;;;;;x
String_as_a_form_of_exercise;as a form of exercise;;;;;;;;;;;;;x
String_to_relax_and_take_your_mind_off_things;to relax and take your mind off things;;;;;;;;;;;;;x
String_to_fully_test_the_abilities_of_your_cybernetics;to fully test the abilities of your cybernetics;;;;;;;;;;;;;x
EVTOPTALIFESTYLE12;Sounds like a great idea.;;;;;;;;;;;;;x
EVTOPTBLIFESTYLE12;Sounds like a waste of time and effort.;;;;;;;;;;;;;x
EVTDESCLIFESTYLE13;You're fascinated by the wildlife of [homeworld.GetName] - and not in a sense of pure scientific curiosity, but in a far more visceral one. There are giant creatures and ferocious beasts out there to contend with. You yearn for the thrill of the predator.;;;;;;;;;;;;;x
EVTOPTALIFESTYLE13;Let the hunt begin!;;;;;;;;;;;;;x
EVTOPTBLIFESTYLE13;Actually, no, it's the curiosity thing.;;;;;;;;;;;;;x
EVTDESCLIFESTYLE14;Most see falconry as an antiquated pursuit, a favored pastime of ancients long consigned to history. You disagree. You think it's time such noble pursuits were brought back.;;;;;;;;;;;;;x
EVTOPTALIFESTYLE14;Fetch me a falcon!;;;;;;;;;;;;;x
EVTOPTBLIFESTYLE14;On second thought, maybe the past should stay in the past.;;;;;;;;;;;;;x
EVTDESCLIFESTYLE15;You have more unfinished novellas than you do hairs. The size of your documents folder has exceded the orbit of Neptune. Yesterday you got into a heated argument about the Oxford comma. Maybe it's time to come clean.;;;;;;;;;;;;;x
EVTOPTALIFESTYLE15;I'm a writer.;;;;;;;;;;;;;x
EVTOPTBLIFESTYLE15;I can quit any time I want!;;;;;;;;;;;;;x
EVTDESCLIFESTYLE16;The world you see in your mind's eye needs to escape. In your free time, you find yourself sketching, trying to put your vision on paper.;;;;;;;;;;;;;x
EVTOPTALIFESTYLE16;I'm an artist.;;;;;;;;;;;;;x
EVTOPTBLIFESTYLE16;I have no real interest in this.;;;;;;;;;;;;;x
EVTDESCLIFESTYLE17;You find yourself naturally drawn to the martial arts - interested in everything from fistfights to how properly handle a laser pistol. And not just for practical reasons - you enjoy the challenge and the competition.;;;;;;;;;;;;;x
EVTOPTALIFESTYLE17;All will fall before my blade!;;;;;;;;;;;;;x
EVTOPTBLIFESTYLE17;Perhaps I should consider a less violent hobby.;;;;;;;;;;;;;x
EVTDESCLIFESTYLE18;Travelling through hyperspace is more than enough to realize just how small the human experience really is. The galaxy is vast, and our knowledge small. Who knows what could be lurking out there, beyond the skin of the world we know?;;;;;;;;;;;;;x
EVTOPTALIFESTYLE18;I will discover the deep mysteries of the cosmos.;;;;;;;;;;;;;x
EVTOPTBLIFESTYLE18;No, even the strangest things can be understood.;;;;;;;;;;;;;x
EVTDESCLIFESTYLE19;You've been spending an awfully long time in VR lately. The real world is so prosaic, so dull. You much prefer building 23rd century space colonies and gunning down hordes of goblins to doing your actual job.;;;;;;;;;;;;;x
EVTOPTALIFESTYLE19;We live in a society.;;;;;;;;;;;;;x
EVTOPTBLIFESTYLE19;Bottom text.;;;;;;;;;;;;;x
EVTDESCLIFESTYLE210;Your friend [From.GetCrisisBestName] is an avid gardener, who dedicates [From.GetHerHis] free time to maintaining a beautiful garden of exotic alien plants. Just taking a walk through it with [From.GetHerHim] is breathtaking, as [From.GetSheHe] enthusiastically shows off every individual specimen.;;;;;;;;;;;;;x
EVTOPTALIFESTYLE210;I think I might take this up myself.;;;;;;;;;;;;;x
EVTOPTBLIFESTYLE210;I'll leave stuff like this to [From.GetHerHim].;;;;;;;;;;;;;x
EVTDESCLIFESTYLE211;Your friend [From.GetCrisisBestName] seems to know absolutely everything. [From.GetSheHeCap] spends entire evenings talking about the details of things you didn't even know existed. It always makes for fascinating conversation.;;;;;;;;;;;;;x
EVTDESCLIFESTYLE212;Your friend [From.GetCrisisBestName] is one of the finest athletes you know, even if [From.GetSheHe] doesn't do it professionally. Today, [From.GetSheHe] challenged you to a one-on-one, and of course soundly defeated you, but you had the time of your life doing it.;;;;;;;;;;;;;x
EVTDESCLIFESTYLE213;Today, your friend [From.GetCrisisBestName] took you on a hunting expedition. You'd never thought much of hunting before, but you have to admit, you enjoyed the thrill of matching wits with some of the most formidable creatures in the galaxy.;;;;;;;;;;;;;x
EVTDESCLIFESTYLE214;One of your friend [From.GetCrisisBestName]'s eccentricities is [From.GetHerHim] love of falconry. You'd always thought it was a strange and unusual hobby, but today you accompanied [From.GetHerHim] on a hunt, and you have to admit, you're a little jealous of the rapport [From.GetSheHe] seems to have with [From.GetHerHis] avian.;;;;;;;;;;;;;x
EVTDESCLIFESTYLE215;Your friend [From.GetCrisisBestName] is an avid writer, with multiple published works. You've always enjoyed reading samples of [From.GetHerHis] works, but you find yourself wishing you could talk to [From.GetHerHim] more about the creative process behind them.;;;;;;;;;;;;;x
EVTDESCLIFESTYLE216;Your friend [From.GetCrisisBestName] is an artist, who spends long hours each day crafting visual splendors in holovision. You spent an hour today just watching [From.GetHerHim] work, fascinated by every detail.;;;;;;;;;;;;;x
EVTDESCLIFESTYLE217;Your friend [From.GetCrisisBestName] is an avid martial artist, and today [From.GetSheHe] invited you to attend a training session. You lost horribly in the sparring, of course, but you found the entire thing fascinating.;;;;;;;;;;;;;x
EVTDESCLIFESTYLE218;Your friend [From.GetCrisisBestName] is, not to put too fine a point on it, weird. [From.GetSheHeCap] calls [From.GetHerselfHimself] a "scientist", but [From.GetSheHe] seems to be spend all [From.GetHerHis] time on things like the Navier-Stokes-Fuchida conjecture and the artificial intelligence problem. You can't help but admit, though, that these unsolved mysteries have a certain appeal.;;;;;;;;;;;;;x
EVTDESCLIFESTYLE219;Your friend [From.GetCrisisBestName] is a huge fan of VR gaming. Today, [From.GetSheHe] invited you to try out one of the latest releases with [From.GetHerHim], and you have to admit - you had a lot of fun.;;;;;;;;;;;;x
EVTDESCLIFESTYLE310;Your friend [From.GetCrisisBestName] asked you if you could lend [From.GetHerHim] a few seeds to start a garden of [From.GetHerHis] own today. Apparently, [From.GetSheHe] has taken an interest in your hobby.;;;;;;;;;;;;;x
EVTOPTALIFESTYLE310;Finally, I'll be able to talk to [From.GetHerHim] about it!;;;;;;;;;;;;;x
EVTDESCLIFESTYLE311;Your friend [From.GetCrisisBestName] asked if [From.GetSheHe] could borrow a few files from your personal archive today. Apparently, [From.GetSheHe] has taken an interest in your hobby.;;;;;;;;;;;;;x
EVTDESCLIFESTYLE312;Your friend [From.GetCrisisBestName] asked if [From.GetSheHe] could join you for practice today. Apparently, [From.GetSheHe] has taken an interest in your hobby.;;;;;;;;;;;;;x
EVTDESCLIFESTYLE313;Your friend [From.GetCrisisBestName] asked if [From.GetSheHe] could join you on your next hunting expedition today. Apparently, [From.GetSheHe] has taken an interest in your hobby.;;;;;;;;;;;;;x
EVTDESCLIFESTYLE314;Your friend [From.GetCrisisBestName] asked you for advice on selecting a falcon today. Apparently, [From.GetSheHe] has taken an interest in your hobby.;;;;;;;;;;;;;x
EVTDESCLIFESTYLE315;Your friend [From.GetCrisisBestName] asked you for advice on writing today. Apparently, [From.GetSheHe] has taken an interest in your hobby.;;;;;;;;;;;;;x
EVTDESCLIFESTYLE316;Your friend [From.GetCrisisBestName] asked you for advice on holosculpting today. Apparently, [From.GetSheHe] has taken an interest in your hobby.;;;;;;;;;;;;;x
EVTDESCLIFESTYLE317;Your friend [From.GetCrisisBestName] asked to spar with you today. Apparently, [From.GetSheHe] has taken an interest in your hobby.;;;;;;;;;;;;;x
EVTDESCLIFESTYLE318;Your friend [From.GetCrisisBestName] asked you about your theories on [Root.GetUnsolvableProblem] today. Apparently, [From.GetSheHe] has taken an interest in the deeper mysteries of the universe.;;;;;;;;;;;;;x
String_navier_stokes_fuchida_conjecture;the Navier-Stokes-Fuchida conjecture;;;;;;;;;;;;;x
String_fermi_paradox;the Fermi Paradox;;;;;;;;;;;;;x
String_ai_problem;the artificial intelligence problem;;;;;;;;;;;;;x
String_hyperspace_physics;hyperspace physics;;;;;;;;;;;;;x
String_question_of_the_soul;the question of the soul;;;;;;;;;;;;;x
String_origin_of_the_universe;the origin of the universe;;;;;;;;;;;;;x
String_continuity_problem;the continuity problem;;;;;;;;;;;;;x
String_question_of_identity;the question of identity;;;;;;;;;;;;;x
String_essence_of_humanity;the essence of humanity;;;;;;;;;;;;;x
EVTDESCLIFESTYLE319;Your friend [From.GetCrisisBestName] asked you for some VR recommendations today. Apparently, [From.GetSheHe] has taken an interest in your hobby.;;;;;;;;;;;;;x
EVTDESCLIFESTYLE0;[potential_friend.GetLifestyleFriendshipDesc];;;;;;;;;;;;;x
String_lifestyle_friendship_gardener;The [Root.Location.GetName] System is hosting an exhibition of exotic alien flora - a perfect opportunity for you to expand your horticultural knowledge. While you're attending, you meet [This.GetCrisisBestName] outside the [GetRandomPlantName] exhibit, and the two of you strike up a conversation. [This.GetSheHeCap] demonstrates a remarkable depth of knowledge about some very interesting alien plant species.;;;;;;;;;;;;;x
String_onideguzu;onideguzu;;;;;;;;;;;;;x
String_omidi_mangrove_tree;Omidi mangrove tree;;;;;;;;;;;;;x
String_steelwood;steelwood;;;;;;;;;;;;;x
String_chengdu_coral;Chengdu coral;;;;;;;;;;;;;x
String_razorgrass;razorgrass;;;;;;;;;;;;;x
String_metagenic_wasp;mti wa nyongo;;;;;;;;;;;;;x
String_cardamine;cardamine;;;;;;;;;;;;;x
String_world_tree;World Tree;;;;;;;;;;;;;x
String_rainbow_grass;herba da vella;;;;;;;;;;;;;x
String_touchdown_tumbleweed;Touchdown tumbleweed;;;;;;;;;;;;;x
String_lifestyle_friendship_intellectual;The [Root.Location.GetName] System is hosting a symposium on [Root.GetRandomIntellectualTopic], a perfect opportunity for you to mingle with your peers. You meet [This.GetCrisisBestName] at the coffee table, and the two of you almost immediately launch into a fascinating discussion of [Root.GetRandomIntellectualTopic].;;;;;;;;;;;;;x
String_physics;physics;;;;;;;;;;;;;x
String_biology;biology;;;;;;;;;;;;;x
String_chemistry;chemistry;;;;;;;;;;;;;x
String_astronomy;astronomy;;;;;;;;;;;;;x
String_mathematics;mathematics;;;;;;;;;;;;;x
String_sociology;sociology;;;;;;;;;;;;;x
String_economics;economics;;;;;;;;;;;;;x
String_cosmology;cosmology;;;;;;;;;;;;;x
String_medicine;medicine;;;;;;;;;;;;;x
String_linguistics;linguistics;;;;;;;;;;;;;x
String_lifestyle_friendship_athlete;The [Root.Location.GetName] System is hosting an amateur sports tournament. [This.GetCrisisBestName] has been assigned to your team, and the two of you have almost immediately developed a surprising rapport while working together.;;;;;;;;;;;;;x
String_lifestyle_friendship_hunter;You meet [This.GetCrisisBestName] at a conference on the topic of wildlife conservation. You and [This.GetSheHe] swap stories of great hunts gone by and scars earned in the pursuit of the galaxy's most dangerous creatures.;;;;;;;;;;;;;x
String_lifestyle_friendship_falconer;It's rare to meet a fellow falconer, so of course when a convention is held in the [Root.Location.GetName] System, you're happy to attend. You spend a pleasant afternoon hunting alongside [This.GetCrisisBestName], who makes for fantastic conversation.;;;;;;;;;;;;;x
String_lifestyle_friendship_poet;You meet [This.GetCrisisBestName] at a writers' workshop, where the two of you are both working on improving your [Root.GetRandomWritingSkill]. You find [This.GetHerHim] surprisingly pleasant company.;;;;;;;;;;;;;x
String_lifestyle_friendship_artist;You are attending an exhibition of [This.GetCrisisBestName]'s work when you're shocked to discover the [This.GetManWoman] [This.GetHerselfHimself] is in attendance. You're thrilled to get a chance to speak to [This.GetHerHim].;;;;;;;;;;;;;x
String_dialogue;dialogue;;;;;;;;;;;;;x
String_prose;prose;;;;;;;;;;;;;x
String_characterization;characterization;;;;;;;;;;;;;x
String_lifestyle_friendship_duelist;The [Root.Location.GetName] System is hosting a martial arts competition, although regrettably you only learned about it too late to register. You meet [This.GetCrisisBestName] while watching from the stands - apparently, [This.GetSheHe] made the same mistake. The two of you manage to amuse yourselves by providing commentary on the ongoing match.;;;;;;;;;;;;;x
String_lifestyle_friendship_mystic;The [Root.Location.GetName] System is hosting an "academic symposium", but when you attend, you are disappointed to find that most of the attendees possess small minds and smaller imaginations. You find yourself relaxing at the cafe when you overhear [This.GetCrisisBestName] expounding on the topic of [This.GetUnsolvableProblem]. You're quick to insert yourself into the conversation.;;;;;;;;;;;;;x
String_lifestyle_friendship_gamer;The [Root.Location.GetName] System is hosting a competitive gaming tournament. Unfortunately, it's for a game you don't play, but you still have little better to do with your time than attend. You meet [This.GetCrisisBestName] in one of the side-events, where [This.GetSheHe] impresses you with the extent of [This.GetHerHis] skill.;;;;;;;;;;;;;x
EVTOPTALIFESTYLE0;This looks like the start of a wonderful friendship.;;;;;;;;;;;;;x
EVTOPTBLIFESTYLE0;I don't think we'll be seeing each other again.;;;;;;;;;;;;;x
EVTDESCLIFESTYLE1010;You've found a rare opportunity - the chance to purchase a specimen of onideguzu, the Demon Creeping Vine of Hiyokuna Oka. This plantoid species is renowned for its motility and unusual behaviors - it is perhaps one of the most intriguing xenobotanical specimens you could hope to acquire.;;;;;;;;;;;;;x
EVTDESCLIFESTYLE1110;You've found a rare opportunity - the chance to purchase a young giant mangrove from Omid III. This tree-like species stands on impressive networks of stilt roots that in the wild can cover an area of over a square kilometer.;;;;;;;;;;;;;x
EVTDESCLIFESTYLE1210;You've found a rare opportunity - the chance to purchase a steelwood sapling from Nae Bangladesa II. This tree-like species is named for its bark, the strongest known organic substance in the galaxy.;;;;;;;;;;;;;x
EVTDESCLIFESTYLE1310;You've found a rare opportunity - the chance to purchase a colony of Chengu coral. Native to Chengdu Prime, this species of polyps forms exotic and colorful reefs not just in water but also on land.;;;;;;;;;;;;;x
EVTDESCLIFESTYLE1410;You've found a rare opportunity - the chance to purchase a specimen of razorgrass. This plantoid species is native to Pu-Erh, and in fact its leaves are responsible for that planet's famous luxury teas. Of course, it's also an extremely dangerous species, with blades sharp enough to sever a human limb.;;;;;;;;;;;;;x
EVTDESCLIFESTYLE1510;You've found a rare opportunity - the chance to purchase a Mti wa Nyongo Tree. This species has one of the most fascinating life-cycles in the known worlds - its "seeds" are in fact tiny insectoid creatures, known as metagenic wasps, that seek out the ideal place for its offspring to grow.;;;;;;;;;;;;;x
EVTDESCLIFESTYLE1610;You've found a rare opportunity - the chance to purchase a clipping of the legendary World Tree of Takagi III! Once thought to be a thick forest of redwood-like dendroids, the World Tree was discovered to be a single clonal organism that covered almost the entirety of Takagi III's sole continent.;;;;;;;;;;;;;x
EVTDESCLIFESTYLE1710;You've found a rare opportunity - the chance to purchase a specimen of herba da vella from Nueva Galicia. This grass-like species is named for the beautiful colors it can produce through the correct epigentic triggers, creating fields and gardens that resemble vibrant rainbows.;;;;;;;;;;;;;x
EVTDESCLIFESTYLE1810;You've found a rare opportunity - the chance to purchase a Touchdown tumbleweed. Unlike Terran tumbleweeds, this plant actually detaches itself from the ground entirely, able to survive on stored water until it finds a place richer in nutrients to sink in its roots.;;;;;;;;;;;;;x
EVTOPTALIFESTYLE1010;This will make the perfect addition to my garden.;;;;;;;;;;;;;x
EVTOPTBLIFESTYLE1010;I can't afford it.;;;;;;;;;;;;;x
EVTDESCLIFESTYLE10010;After several weeks of effort, you have successfully managed to set off the correct epigenetic triggers in your herba da vella to grow a solid patch of red grass. Strategically placed, it looks beautiful in your garden.;;;;;;;;;;;;;x
EVTOPTALIFESTYLE10010;A satisfying job well done.;;;;;;;;;;;;;x
EVTDESCLIFESTYLE10110;After several weeks of effort, you have successfully managed to set off the correct epigenetic triggers in your herba da vella to grow a solid patch of green grass, which may not sound particularly impressive, but nevertheless makes a fine sight in your garden.;;;;;;;;;;;;;x
EVTDESCLIFESTYLE10210;After several weeks of effort, you have successfully managed to set off the correct epigenetic triggers in your herba da vella to grow a solid patch of blue grass. Strategically placed, it looks beautiful in your garden.;;;;;;;;;;;;;x
EVTDESCLIFESTYLE10310;Without your consistent and diligent care, the solid patch of red grass in your specimen of herba da vella has become so intermixed with other colors that it is no longer visible.;;;;;;;;;;;;;x
EVTOPTALIFESTYLE10310;A pity.;;;;;;;;;;;;;x
EVTOPTBLIFESTYLE10310;Well, this is frustrating.;;;;;;;;;;;;;x
EVTOPTCLIFESTYLE10310;All that work for nothing.;;;;;;;;;;;;;x
EVTDESCLIFESTYLE10410;Without your consistent and diligent care, the solid patch of green grass in your specimen of herba da vella has become so intermixed with other colors that it is no longer visible.;;;;;;;;;;;;;x
EVTDESCLIFESTYLE10510;Without your consistent and diligent care, the solid patch of blue grass in your specimen of herba da vella has become so intermixed with other colors that it is no longer visible.;;;;;;;;;;;;;x
EVTDESCLIFESTYLE10610;You decided to tend to your onideguzu specimen today. That may have been a mistaken. The plant lashed out at you with its tendrils and knocked you backwards into a glass display case.;;;;;;;;;;;;;x
EVTOPTALIFESTYLE10610;Destroy it immediately.;;;;;;;;;;;;;x
EVTOPTBLIFESTYLE10610;Keep it anyway.;;;;;;;;;;;;;x
EVTDESCLIFESTYLE10710;You've been keeping close tabs on your onideguzu specimen today. It's still alive - in fact, it seems to be in perfect health - but its colors have faded. Once it displayed a kaleidoscope of images on its writhing tendrils. Now they hang limp and are a dull green. Even when it's in bloom, the tendrils stay dimmed. It's almost like it's moping.;;;;;;;;;;;;;x
EVTOPTALIFESTYLE10710;What strange behavior.;;;;;;;;;;;;;x
EVTDESCLIFESTYLE10810;You went to tend to your onideguzu specimen today, and to your surprise it reacted to you. The moment you began to water it, its tendrils perked up and turned a bright cherry red, the brightest color you've seen from it in quite some time. You're not sure what's happening, but it seems to respond positively to your presence now.;;;;;;;;;;;;;x
EVTOPTALIFESTYLE10810;At lest it's well-behaved.;;;;;;;;;;;;;x
EVTDESCLIFESTYLE10910;As you were watering your onideguzu specimen today, its tendrils suddenly twisted and turned a bright cherry red, then violet, then gold, writhing like a nest of colorful snakes.;;;;;;;;;;;;;x
EVTOPTALIFESTYLE10910;It was a beautiful display.;;;;;;;;;;;;;x
EVTDESCLIFESTYLE11810;You've spent several weeks now studying the bark of your steelwood tree. It's the strongest known organic substance in the known worlds, stronger even than some materials used in modern combat armor. While you don't think you'll be plating any warships in steelwood timber like a second millennium galleon, there's a lot to be learned about materials science here.;;;;;;;;;;;;;x
EVTOPTALIFESTYLE11810;Although the galleon thing would certainly be amusing.;;;;;;;;;;;;;x
EVTDESCLIFESTYLE11910;Your garden is a corncucopia of the strange and exotic, filled with plantoids and fungoids from across the known worlds. You've recently been making a study of your [examined_plant.GetName] in particular. There's a lot to be learned here about xenobiology.;;;;;;;;;;;;;x
EVTOPTALIFESTYLE11910;This may help our colonization efforts.;;;;;;;;;;;;;x
EVTDESCLIFESTYLE12010;It's taken you months, but you've managed to herd a cluster of Chengdu coral polyps in such a way as to create a little decorative sculpture. Soon the polyps will die and it will turn bleach white, but even then, your art will persist.;;;;;;;;;;;;;x
EVTOPTALIFESTYLE12010;Keep it.;;;;;;;;;;;;;x
EVTOPTBLIFESTYLE12010;Sell it.;;;;;;;;;;;;;x
EVTDESCLIFESTYLE20010;Unfortunately for your [dead_plant.GetName], you are in no position to provide the tender care it requires. Without your diligent attention, it has failed to reproduce, withered, and died.;;;;;;;;;;;;;x
EVTOPTALIFESTYLE20010;What a shame.;;;;;;;;;;;;;x
purchase_onideguzu_specimen_decision;Purchase an Onideguzu Specimen;;;;;;;;;;;;;x
purchase_onideguzu_specimen_decision_desc;[Root.GetCrisisBestName] owns a rare Onideguzu Specimen that [Root.GetSheHe] has no idea how to properly care for. You could arrange to purchase it for 100 credits.;;;;;;;;;;;;;x
purchase_omidi_giant_mangrove_specimen_decision;Purchase an Omidi Giant Mangrove;;;;;;;;;;;;;x
purchase_omidi_giant_mangrove_specimen_decision_desc;[Root.GetCrisisBestName] owns a rare Omidi Giant Mangrove that [Root.GetSheHe] has no idea how to properly care for. You could arrange to purchase it for 100 credits.;;;;;;;;;;;;;x
purchase_steelwood_specimen_decision;Purchase a Steelwood Tree;;;;;;;;;;;;;x
purchase_steelwood_specimen_decision_desc;[Root.GetCrisisBestName] owns a rare Steelwood Tree that [Root.GetSheHe] has no idea how to properly care for. You could arrange to purchase it for 100 credits.;;;;;;;;;;;;;x
purchase_chengdu_coral_specimen_decision;Purchase a Chengdu Coral Colony;;;;;;;;;;;;;x
purchase_chengdu_coral_specimen_decision_desc;[Root.GetCrisisBestName] owns a rare Chengdu Coral Colony that [Root.GetSheHe] has no idea how to properly care for. You could arrange to purchase it for 100 credits.;;;;;;;;;;;;;x
purchase_razorgrass_specimen_decision;Purchase a Razorgrass Specimen;;;;;;;;;;;;;x
purchase_razorgrass_specimen_decision_desc;[Root.GetCrisisBestName] owns a rare Razorgrass Specimen that [Root.GetSheHe] has no idea how to properly care for. You could arrange to purchase it for 100 credits.;;;;;;;;;;;;;x
purchase_metagenic_wasp_specimen_decision;Purchase a Mti wa Nyongo Tree;;;;;;;;;;;;;x
purchase_metagenic_wasp_specimen_decision_desc;[Root.GetCrisisBestName] owns a rare Mti wa Nyongo Tree that [Root.GetSheHe] has no idea how to properly care for. You could arrange to purchase it for 100 credits.;;;;;;;;;;;;;x
purchase_world_tree_specimen_decision;Purchase a World Tree Clipping;;;;;;;;;;;;;x
purchase_world_tree_specimen_decision_desc;[Root.GetCrisisBestName] owns a rare World Tree Clipping that [Root.GetSheHe] has no idea how to properly care for. You could arrange to purchase it for 100 credits.;;;;;;;;;;;;;x
purchase_rainbow_grass_specimen_decision;Purchase a Herba da Vella Specimen;;;;;;;;;;;;;x
purchase_rainbow_grass_specimen_decision_desc;[Root.GetCrisisBestName] owns a rare Herba da Vella Specimen that [Root.GetSheHe] has no idea how to properly care for. You could arrange to purchase it for 100 credits.;;;;;;;;;;;;;x
purchase_touchdown_tumbleweed_specimen_decision;Purchase a Touchdown Tumbleweed;;;;;;;;;;;;;x
purchase_touchdown_tumbleweed_specimen_decision_desc;[Root.GetCrisisBestName] owns a rare Touchdown Tumbleweed that [Root.GetSheHe] has no idea how to properly care for. You could arrange to purchase it for 100 credits.;;;;;;;;;;;;;x
EVTDESCLIFESTYLE30010;TO: [Root.GetCrisisBestName]\nFROM: [purchaser.GetCrisisBestName]\nRE: [purchased_plant.GetName]\nI understand that you are in possession of a [purchased_plant.GetName]. I will be blunt - you do not how to properly care for this rare and valuable organism. I do. I am also prepapred to pay you a hundred credits for it.;;;;;;;;;;;;;x
EVTDESCLIFESTYLE30110;TO: [Root.GetCrisisBestName]\nFROM: [From.GetCrisisBestName]\nRE: [purchased_plant.GetName]\nAfter much consideration, I have decided to accept your offer. The [purchased_plant.GetName] is yours.;;;;;;;;;;;;;x
EVTDESCLIFESTYLE30210;TO: [Root.GetCrisisBestName]\nFROM: [From.GetCrisisBestName]\nRE: [purchased_plant.GetName]\nI regret to inform you that I must decline your offer.;;;;;;;;;;;;;x
onideguzu_specimen;Onideguzu Specimen;;;;;;;;;;;;;x
